      -----------------------------------------------------------      
     |                   =====================                   |     
     |                           x T B                           |     
     |                   =====================                   |     
     |                         S. Grimme                         |     
     |          Mulliken Center for Theoretical Chemistry        |     
     |                    University of Bonn                     |     
      -----------------------------------------------------------      

   * xtb version 6.2.3 (830e466) compiled by 'ehlert@majestix' on 2020-03-16

   xtb is free software: you can redistribute it and/or modify it under
   the terms of the GNU Lesser General Public License as published by
   the Free Software Foundation, either version 3 of the License, or
   (at your option) any later version.
   
   xtb is distributed in the hope that it will be useful,
   but WITHOUT ANY WARRANTY; without even the implied warranty of
   MERCHANTABILITY or FITNESS FOR A PARTICULAR PURPOSE.  See the
   GNU Lesser General Public License for more details.
   
   Cite this work as:
   * S. Grimme, C. Bannwarth, P. Shushkov, J. Chem. Theory Comput., 2017,
     13, 1989-2009. DOI: 10.1021/acs.jctc.7b00118
   * C. Bannwarth, S. Ehlert and S. Grimme., J. Chem. Theory Comput., 2019,
     15, 1652-1671. DOI: 10.1021/acs.jctc.8b01176
   * P. Pracht, E. Caldeweyher, S. Ehlert, S. Grimme, ChemRxiv, 2019, preprint.
     DOI: 10.26434/chemrxiv.8326202.v1
   
   for DFT-D4:
   * E. Caldeweyher, C. Bannwarth and S. Grimme, J. Chem. Phys., 2017,
     147, 034112. DOI: 10.1063/1.4993215
   * E. Caldeweyher, S. Ehlert, A. Hansen, H. Neugebauer, S. Spicher,
     C. Bannwarth and S. Grimme, J. Chem. Phys., 2019, 150, 154122.
     DOI: 10.1063/1.5090222
   
   for sTDA-xTB:
   * S. Grimme and C. Bannwarth, J. Chem. Phys., 2016, 145, 054103.
     DOI: 10.1063/1.4959605
   
   in the mass-spec context:
   * V. Asgeirsson, C. Bauer and S. Grimme, Chem. Sci., 2017, 8, 4879.
     DOI: 10.1039/c7sc00601b
   
   for metadynamics refer to:
   * S. Grimme, J. Chem. Theory Comput., 2019, 155, 2847-2862
     DOI: 10.1021/acs.jctc.9b00143
   
   with help from (in alphabetical order)
   C. Bannwarth, F. Bohle, G. Brandenburg, E. Caldeweyher, M. Checinski,
   S. Dohm, S. Ehlert, S. Ehrlich, F. März, H. Neugebauer, J. Pisarek,
   P. Pracht, P. Shushkov, and S. Spicher.
   
 * started run on 2020/04/06 at 00:21:25.007     

           -------------------------------------------------
          |                Calculation Setup                |
           -------------------------------------------------

          program call               : /home/tom/.local/bin/xtb opt_xtb.xyz --chrg 0 --opt
          coordinate file            : opt_xtb.xyz
          omp threads                :                     1
          number of atoms            :                    22
          number of electrons        :                    66
          charge                     :                     0
          spin                       :                   0.0
          first test random number   :      0.92284845814207

########################################################################
[WARNING] Please study the warnings concerning your input carefully
-2- prog_main: XTBPATH is not set, using XTBHOME instead
-1- prog_main: XTBHOME is not set, using HOME instead
########################################################################
           ------------------------------------------------- 
          |                 G F N 2 - x T B                 |
          | Geometry, Frequencies, Noncovalent interactions |
          |            JCTC 2019 parametrisation            |
           ------------------------------------------------- 
             k(s)              :                1.8500
             k(p)              :                2.2300
             k(d)              :                2.2300
             k(f)              :                2.0000
             kEN (H0ij)        :               -2.0000
             D4 a1             :                0.5200
             D4 a2             :                5.0000
             D4 s6             :                1.0000
             D4 s8             :                2.7000
             D4 s9             :                5.0000
             alphaj            :                2.0000

  Z AO/shell   Hii/eV     exponent
  1     Wed Apr 25 08:07:45 CEST 2018   EN: 2.200 GM2: 0.406  GM3: 0.0800  RAES: 1.40
     1s    -10.707211    1.230000
  6     Wed Apr 25 08:07:45 CEST 2018   EN: 2.550 GM2: 0.538  GM3: 0.1500  RAES: 3.00
     2s    -13.970922    2.096432
     2p    -10.063292    1.800000
  7     Wed Apr 25 08:07:45 CEST 2018   EN: 3.040 GM2: 0.461  GM3:-0.0640  RAES: 1.90
     2s    -16.686243    2.339881
     2p    -12.523956    2.014332
  8     Wed Apr 25 08:07:45 CEST 2018   EN: 3.440 GM2: 0.452  GM3:-0.0517  RAES: 1.80
     2s    -20.229985    2.439742
     2p    -15.503117    2.137023

           ------------------------------------------------- 
          |        Self-Consistent Charge Iterations        |
           ------------------------------------------------- 

          ...................................................
          :                      SETUP                      :
          :.................................................:
          :  # basis functions                  61          :
          :  # atomic orbitals                  61          :
          :  # shells                           35          :
          :  # electrons                        66          :
          :  max. iterations                   250          :
          :  Hamiltonian                  GFN2-xTB          :
          :  restarted?                      false          :
          :  GBSA solvation                  false          :
          :  PC potential                    false          :
          :  electronic temp.          300.0000000     K    :
          :  accuracy                    1.0000000          :
          :  -> integral cutoff          0.2500000E+02      :
          :  -> integral neglect         0.1000000E-07      :
          :  -> SCF convergence          0.1000000E-05 Eh   :
          :  -> wf. convergence          0.1000000E-03 e    :
          :  Broyden damping             0.4000000          :
          ...................................................

 iter      E             dE          RMSdq      gap      omega  full diag
   1    -37.3616023 -0.373616E+02  0.469E+00    2.08       0.0  T
   2    -37.4240674 -0.624651E-01  0.250E+00    1.58       1.0  T
   3    -37.4312099 -0.714252E-02  0.173E+00    1.76       1.0  T
   4    -37.4485054 -0.172955E-01  0.220E-01    1.40       1.0  T
   5    -37.4489127 -0.407305E-03  0.142E-01    1.41       1.0  T
   6    -37.4491930 -0.280308E-03  0.527E-02    1.42       1.0  T
   7    -37.4492067 -0.136683E-04  0.188E-02    1.43       1.1  T
   8    -37.4492072 -0.554720E-06  0.113E-02    1.43       1.9  T
   9    -37.4492090 -0.177945E-05  0.351E-03    1.43       6.1  T
  10    -37.4492091 -0.108347E-06  0.127E-03    1.43      16.8  T
  11    -37.4492091 -0.776888E-08  0.515E-04    1.43      41.4  T
  12    -37.4492091 -0.157148E-08  0.163E-04    1.43     130.6  T

   *** convergence criteria satisfied after 12 iterations ***

         #    Occupation            Energy/Eh            Energy/eV
      -------------------------------------------------------------
         1        2.0000           -0.7248542             -19.7243
       ...           ...                  ...                  ...
        27        2.0000           -0.4662393             -12.6870
        28        2.0000           -0.4637005             -12.6179
        29        2.0000           -0.4499684             -12.2443
        30        2.0000           -0.4259572             -11.5909
        31        2.0000           -0.4161309             -11.3235
        32        2.0000           -0.4107835             -11.1780
        33        2.0000           -0.3905025             -10.6261 (HOMO)
        34                         -0.3380762              -9.1995 (LUMO)
        35                         -0.2694407              -7.3319
        36                         -0.2266498              -6.1675
        37                         -0.1910175              -5.1979
        38                         -0.0041985              -0.1142
       ...                                ...                  ...
        61                          0.6516626              17.7326
      -------------------------------------------------------------
                  HL-Gap            0.0524263 Eh            1.4266 eV
             Fermi-level           -0.3642893 Eh           -9.9128 eV

 SCC (total)                   0 d,  0 h,  0 min,  0.021 sec
 SCC setup                      ...        0 min,  0.000 sec (  0.650%)
 Dispersion                     ...        0 min,  0.000 sec (  0.486%)
 integral evaluation            ...        0 min,  0.005 sec ( 26.259%)
 zeroth order Hamiltonian       ...        0 min,  0.000 sec (  0.438%)
 iterations                     ...        0 min,  0.006 sec ( 30.579%)
 molecular gradient             ...        0 min,  0.009 sec ( 41.124%)
 printout                       ...        0 min,  0.000 sec (  0.361%)

         :::::::::::::::::::::::::::::::::::::::::::::::::::::
         ::                     SUMMARY                     ::
         :::::::::::::::::::::::::::::::::::::::::::::::::::::
         :: total energy             -36.957418718612 Eh    ::
         :: gradient norm              0.153582958328 Eh/a0 ::
         :: HOMO-LUMO gap              1.426592573777 eV    ::
         ::.................................................::
         :: SCC energy               -37.449209138861 Eh    ::
         :: -> isotropic ES            0.062009920473 Eh    ::
         :: -> anisotropic ES          0.003384588731 Eh    ::
         :: -> anisotropic XC          0.017738885089 Eh    ::
         :: -> dispersion             -0.023687120223 Eh    ::
         :: repulsion energy           0.491613663858 Eh    ::
         :: add. restraining           0.000000000000 Eh    ::
         :::::::::::::::::::::::::::::::::::::::::::::::::::::

      ----------------------------------------------------------- 
     |                   =====================                   |
     |                        A N C O P T                        |
     |                   =====================                   |
     |               Approximate Normal Coordinate               |
     |                Rational Function Optimizer                |
      ----------------------------------------------------------- 

          ...................................................
          :                      SETUP                      :
          :.................................................:
          :   optimization level            normal          :
          :   max. optcycles                   200          :
          :   ANC micro-cycles                  20          :
          :   degrees of freedom                60          :
          :.................................................:
          :   RF solver                   davidson          :
          :   write xtbopt.log                true          :
          :   linear?                        false          :
          :   energy convergence         0.5000000E-05 Eh   :
          :   grad. convergence          0.1000000E-02 Eh/α :
          :   maximium RF displ.         1.0000000          :
          :   Hlow (freq-cutoff)         0.1000000E-01      :
          :   Hmax (freq-cutoff)         5.0000000          :
          :   S6 in model hess.         20.0000000          :
          ...................................................

generating ANC from model Hessian ...
Using Lindh-Hessian (1995)
 Shifting diagonal of input Hessian by   5.429550665339687E-003
 Lowest  eigenvalues of input Hessian
   -0.000000   -0.000000    0.000000    0.000000    0.000000    0.000000
    0.010000    0.011116    0.018149    0.020638    0.027793    0.031041
    0.032806    0.034963    0.048474    0.052020    0.065023    0.067835
 Highest eigenvalues
    1.601066    1.753907    1.836071    1.898251    2.025129    2.153148
 

........................................................................
.............................. CYCLE    1 ..............................
........................................................................
   1    -37.4492091 -0.374492E+02  0.726E-05    1.43       0.0  T
   2    -37.4492091 -0.104450E-10  0.419E-05    1.43     509.2  T
   3    -37.4492091  0.262901E-12  0.202E-05    1.43    1053.5  T
     SCC iter.                  ...        0 min,  0.001 sec
     gradient                   ...        0 min,  0.008 sec
 * total energy  :   -36.9574187 Eh     change       -0.1391268E-07 Eh
   gradient norm :     0.1535836 Eh/α   predicted     0.0000000E+00 (-100.00%)
   displ. norm   :     0.3733983 α      lambda       -0.2812557E-01
   maximum displ.:     0.1385949 α      in ANC's #6, #2, #7, ...

........................................................................
.............................. CYCLE    2 ..............................
........................................................................
   1    -37.4592399 -0.374592E+02  0.289E-01    1.51       0.0  T
   2    -37.4597688 -0.528866E-03  0.192E-01    1.48       1.0  T
   3    -37.4598356 -0.668432E-04  0.986E-02    1.46       1.0  T
   4    -37.4598336  0.206555E-05  0.437E-02    1.46       1.0  T
   5    -37.4598660 -0.324424E-04  0.108E-02    1.46       2.0  T
   6    -37.4598668 -0.793710E-06  0.507E-03    1.46       4.2  T
   7    -37.4598670 -0.242340E-06  0.178E-03    1.46      12.0  T
     SCC iter.                  ...        0 min,  0.003 sec
     gradient                   ...        0 min,  0.008 sec
 * total energy  :   -36.9770694 Eh     change       -0.1965068E-01 Eh
   gradient norm :     0.0700118 Eh/α   predicted    -0.1602352E-01 ( -18.46%)
   displ. norm   :     0.3150541 α      lambda       -0.9160729E-02
   maximum displ.:     0.2061911 α      in ANC's #2, #8, #6, ...

........................................................................
.............................. CYCLE    3 ..............................
........................................................................
   1    -37.4658418 -0.374658E+02  0.241E-01    1.51       0.0  T
   2    -37.4661644 -0.322618E-03  0.160E-01    1.51       1.0  T
   3    -37.4662069 -0.425295E-04  0.796E-02    1.49       1.0  T
   4    -37.4662196 -0.126541E-04  0.183E-02    1.50       1.2  T
   5    -37.4662235 -0.388531E-05  0.716E-03    1.49       3.0  T
   6    -37.4662235 -0.305551E-07  0.480E-03    1.50       4.4  T
   7    -37.4662238 -0.283079E-06  0.157E-03    1.50      13.6  T
     SCC iter.                  ...        0 min,  0.003 sec
     gradient                   ...        0 min,  0.008 sec
 * total energy  :   -36.9826085 Eh     change       -0.5539061E-02 Eh
   gradient norm :     0.0189725 Eh/α   predicted    -0.5035018E-02 (  -9.10%)
   displ. norm   :     0.3174727 α      lambda       -0.1810968E-02
   maximum displ.:     0.2825989 α      in ANC's #2, #8, #1, ...

........................................................................
.............................. CYCLE    4 ..............................
........................................................................
   1    -37.4648774 -0.374649E+02  0.197E-01    1.49       0.0  T
   2    -37.4649008 -0.234027E-04  0.119E-01    1.51       1.0  T
   3    -37.4648537  0.470822E-04  0.616E-02    1.51       1.0  T
   4    -37.4649110 -0.573301E-04  0.136E-02    1.51       1.6  T
   5    -37.4649138 -0.283214E-05  0.591E-03    1.51       3.6  T
   6    -37.4649140 -0.158362E-06  0.301E-03    1.51       7.1  T
   7    -37.4649140 -0.172460E-07  0.135E-03    1.51      15.8  T
   8    -37.4649140 -0.243020E-07  0.478E-04    1.51      44.6  T
     SCC iter.                  ...        0 min,  0.003 sec
     gradient                   ...        0 min,  0.008 sec
 * total energy  :   -36.9839422 Eh     change       -0.1333738E-02 Eh
   gradient norm :     0.0111603 Eh/α   predicted    -0.9967491E-03 ( -25.27%)
   displ. norm   :     0.3323302 α      lambda       -0.1135156E-02
   maximum displ.:     0.2978693 α      in ANC's #2, #1, #8, ...

........................................................................
.............................. CYCLE    5 ..............................
........................................................................
   1    -37.4654326 -0.374654E+02  0.197E-01    1.48       0.0  T
   2    -37.4654472 -0.145763E-04  0.119E-01    1.50       1.0  T
   3    -37.4653856  0.615644E-04  0.657E-02    1.51       1.0  T
   4    -37.4654583 -0.726483E-04  0.103E-02    1.51       2.1  T
   5    -37.4654594 -0.108660E-05  0.544E-03    1.51       3.9  T
   6    -37.4654594 -0.639794E-07  0.289E-03    1.51       7.4  T
   7    -37.4654595 -0.472795E-07  0.126E-03    1.51      16.9  T
     SCC iter.                  ...        0 min,  0.003 sec
     gradient                   ...        0 min,  0.008 sec
 * total energy  :   -36.9848328 Eh     change       -0.8905963E-03 Eh
   gradient norm :     0.0101934 Eh/α   predicted    -0.6302636E-03 ( -29.23%)
   displ. norm   :     0.3460065 α      lambda       -0.9028421E-03
   maximum displ.:     0.2983768 α      in ANC's #2, #1, #5, ...

........................................................................
.............................. CYCLE    6 ..............................
........................................................................
   1    -37.4674266 -0.374674E+02  0.201E-01    1.48       0.0  T
   2    -37.4674402 -0.135803E-04  0.121E-01    1.50       1.0  T
   3    -37.4673808  0.593504E-04  0.640E-02    1.51       1.0  T
   4    -37.4674504 -0.695456E-04  0.983E-03    1.51       2.2  T
   5    -37.4674513 -0.936101E-06  0.524E-03    1.51       4.1  T
   6    -37.4674513  0.282078E-08  0.286E-03    1.50       7.5  T
   7    -37.4674514 -0.907466E-07  0.108E-03    1.50      19.8  T
     SCC iter.                  ...        0 min,  0.003 sec
     gradient                   ...        0 min,  0.008 sec
 * total energy  :   -36.9855786 Eh     change       -0.7457492E-03 Eh
   gradient norm :     0.0115598 Eh/α   predicted    -0.5054663E-03 ( -32.22%)
   displ. norm   :     0.4164992 α      lambda       -0.9032833E-03
   maximum displ.:     0.3492366 α      in ANC's #2, #1, #5, ...

........................................................................
.............................. CYCLE    7 ..............................
........................................................................
   1    -37.4693836 -0.374694E+02  0.240E-01    1.48       0.0  T
   2    -37.4693982 -0.145848E-04  0.145E-01    1.50       1.0  T
   3    -37.4693074  0.907608E-04  0.779E-02    1.50       1.0  T
   4    -37.4694129 -0.105486E-03  0.106E-02    1.50       2.0  T
   5    -37.4694138 -0.908675E-06  0.609E-03    1.50       3.5  T
   6    -37.4694138  0.112201E-07  0.342E-03    1.50       6.2  T
   7    -37.4694139 -0.152283E-06  0.105E-03    1.50      20.4  T
   8    -37.4694139 -0.998407E-08  0.375E-04    1.50      56.9  T
     SCC iter.                  ...        0 min,  0.003 sec
     gradient                   ...        0 min,  0.008 sec
 * total energy  :   -36.9863104 Eh     change       -0.7318038E-03 Eh
   gradient norm :     0.0117076 Eh/α   predicted    -0.5299923E-03 ( -27.58%)
   displ. norm   :     0.4742995 α      lambda       -0.8007613E-03
   maximum displ.:     0.3929049 α      in ANC's #2, #1, #4, ...

........................................................................
.............................. CYCLE    8 ..............................
........................................................................
   1    -37.4699806 -0.374700E+02  0.277E-01    1.48       0.0  T
   2    -37.4699950 -0.144276E-04  0.167E-01    1.49       1.0  T
   3    -37.4698674  0.127586E-03  0.911E-02    1.50       1.0  T
   4    -37.4700147 -0.147283E-03  0.111E-02    1.50       1.9  T
   5    -37.4700153 -0.591773E-06  0.695E-03    1.50       3.1  T
   6    -37.4700153 -0.316702E-07  0.392E-03    1.50       5.4  T
   7    -37.4700155 -0.202480E-06  0.105E-03    1.50      20.4  T
   8    -37.4700155 -0.992608E-08  0.398E-04    1.50      53.5  T
     SCC iter.                  ...        0 min,  0.003 sec
     gradient                   ...        0 min,  0.008 sec
 * total energy  :   -36.9869293 Eh     change       -0.6189658E-03 Eh
   gradient norm :     0.0121997 Eh/α   predicted    -0.4904508E-03 ( -20.76%)
   displ. norm   :     0.4424423 α      lambda       -0.6098435E-03
   maximum displ.:     0.3608904 α      in ANC's #2, #1, #4, ...

........................................................................
.............................. CYCLE    9 ..............................
........................................................................
   1    -37.4717700 -0.374718E+02  0.257E-01    1.50       0.0  T
   2    -37.4717788 -0.880069E-05  0.155E-01    1.50       1.0  T
   3    -37.4716826  0.962013E-04  0.800E-02    1.51       1.0  T
   4    -37.4717935 -0.110891E-03  0.929E-03    1.50       2.3  T
   5    -37.4717936 -0.155172E-06  0.611E-03    1.50       3.5  T
   6    -37.4717937 -0.125491E-06  0.315E-03    1.50       6.8  T
   7    -37.4717939 -0.135675E-06  0.800E-04    1.50      26.7  T
   8    -37.4717939 -0.568383E-08  0.353E-04    1.50      60.5  T
     SCC iter.                  ...        0 min,  0.003 sec
     gradient                   ...        0 min,  0.008 sec
 * total energy  :   -36.9873697 Eh     change       -0.4403779E-03 Eh
   gradient norm :     0.0077416 Eh/α   predicted    -0.3646135E-03 ( -17.20%)
   displ. norm   :     0.4231140 α      lambda       -0.4202839E-03
   maximum displ.:     0.3387498 α      in ANC's #2, #1, #4, ...

........................................................................
.............................. CYCLE   10 ..............................
........................................................................
   1    -37.4698547 -0.374699E+02  0.272E-01    1.47       0.0  T
   2    -37.4698848 -0.301019E-04  0.167E-01    1.49       1.0  T
   3    -37.4697100  0.174857E-03  0.105E-01    1.49       1.0  T
   4    -37.4699135 -0.203485E-03  0.133E-02    1.49       1.6  T
   5    -37.4699147 -0.124623E-05  0.743E-03    1.49       2.9  T
   6    -37.4699148 -0.112450E-06  0.446E-03    1.49       4.8  T
   7    -37.4699149 -0.864557E-07  0.191E-03    1.49      11.1  T
   8    -37.4699150 -0.520898E-07  0.419E-04    1.49      50.9  T
     SCC iter.                  ...        0 min,  0.003 sec
     gradient                   ...        0 min,  0.008 sec
 * total energy  :   -36.9875040 Eh     change       -0.1343353E-03 Eh
   gradient norm :     0.0228861 Eh/α   predicted    -0.2477646E-03 (  84.44%)
   displ. norm   :     0.1635921 α      lambda       -0.5526898E-03
   maximum displ.:     0.1071389 α      in ANC's #2, #1, #4, ...

........................................................................
.............................. CYCLE   11 ..............................
........................................................................
   1    -37.4759690 -0.374760E+02  0.102E-01    1.53       0.0  T
   2    -37.4759869 -0.178804E-04  0.620E-02    1.52       1.0  T
   3    -37.4759710  0.158923E-04  0.379E-02    1.52       1.0  T
   4    -37.4759918 -0.207907E-04  0.102E-02    1.52       2.1  T
   5    -37.4759935 -0.170572E-05  0.279E-03    1.52       7.6  T
   6    -37.4759935 -0.514361E-07  0.173E-03    1.52      12.3  T
     SCC iter.                  ...        0 min,  0.003 sec
     gradient                   ...        0 min,  0.008 sec
 * total energy  :   -36.9877624 Eh     change       -0.2583519E-03 Eh
   gradient norm :     0.0061242 Eh/α   predicted    -0.2837449E-03 (   9.83%)
   displ. norm   :     0.2282127 α      lambda       -0.1736557E-03
   maximum displ.:     0.1605202 α      in ANC's #2, #1, #4, ...

........................................................................
.............................. CYCLE   12 ..............................
........................................................................
   1    -37.4731032 -0.374731E+02  0.144E-01    1.52       0.0  T
   2    -37.4731066 -0.337827E-05  0.873E-02    1.53       1.0  T
   3    -37.4730828  0.238153E-04  0.380E-02    1.53       1.0  T
   4    -37.4731102 -0.274209E-04  0.574E-03    1.53       3.7  T
   5    -37.4731104 -0.201095E-06  0.350E-03    1.53       6.1  T
   6    -37.4731104 -0.432918E-07  0.160E-03    1.53      13.3  T
   7    -37.4731104 -0.118440E-07  0.731E-04    1.53      29.2  T
     SCC iter.                  ...        0 min,  0.003 sec
     gradient                   ...        0 min,  0.008 sec
 * total energy  :   -36.9878811 Eh     change       -0.1187016E-03 Eh
   gradient norm :     0.0065962 Eh/α   predicted    -0.9136090E-04 ( -23.03%)
   displ. norm   :     0.2395036 α      lambda       -0.2272394E-03
   maximum displ.:     0.1302165 α      in ANC's #2, #4, #1, ...

........................................................................
.............................. CYCLE   13 ..............................
........................................................................
   1    -37.4718258 -0.374718E+02  0.180E-01    1.52       0.0  T
   2    -37.4718359 -0.100428E-04  0.110E-01    1.53       1.0  T
   3    -37.4718114  0.244525E-04  0.393E-02    1.53       1.0  T
   4    -37.4718410 -0.295950E-04  0.886E-03    1.53       2.4  T
   5    -37.4718418 -0.819841E-06  0.461E-03    1.53       4.6  T
   6    -37.4718419 -0.491274E-07  0.206E-03    1.53      10.4  T
   7    -37.4718419 -0.164707E-07  0.776E-04    1.53      27.5  T
     SCC iter.                  ...        0 min,  0.003 sec
     gradient                   ...        0 min,  0.008 sec
 * total energy  :   -36.9880405 Eh     change       -0.1593957E-03 Eh
   gradient norm :     0.0123691 Eh/α   predicted    -0.1201406E-03 ( -24.63%)
   displ. norm   :     0.2265842 α      lambda       -0.3470313E-03
   maximum displ.:     0.1554467 α      in ANC's #4, #1, #7, ...

........................................................................
.............................. CYCLE   14 ..............................
........................................................................
   1    -37.4714117 -0.374714E+02  0.196E-01    1.52       0.0  T
   2    -37.4714228 -0.111064E-04  0.121E-01    1.54       1.0  T
   3    -37.4714156  0.717447E-05  0.266E-02    1.54       1.0  T
   4    -37.4714279 -0.122642E-04  0.982E-03    1.54       2.2  T
   5    -37.4714288 -0.979795E-06  0.518E-03    1.54       4.1  T
   6    -37.4714289 -0.783473E-07  0.209E-03    1.54      10.2  T
   7    -37.4714289 -0.197624E-07  0.758E-04    1.54      28.1  T
     SCC iter.                  ...        0 min,  0.003 sec
     gradient                   ...        0 min,  0.008 sec
 * total energy  :   -36.9882945 Eh     change       -0.2539829E-03 Eh
   gradient norm :     0.0135546 Eh/α   predicted    -0.1824295E-03 ( -28.17%)
   displ. norm   :     0.2511540 α      lambda       -0.3594118E-03
   maximum displ.:     0.1602370 α      in ANC's #4, #1, #2, ...

........................................................................
.............................. CYCLE   15 ..............................
........................................................................
   1    -37.4728895 -0.374729E+02  0.210E-01    1.55       0.0  T
   2    -37.4729007 -0.111920E-04  0.129E-01    1.56       1.0  T
   3    -37.4728600  0.406883E-04  0.492E-02    1.56       1.0  T
   4    -37.4729094 -0.494000E-04  0.910E-03    1.56       2.3  T
   5    -37.4729098 -0.395799E-06  0.546E-03    1.56       3.9  T
   6    -37.4729099 -0.890860E-07  0.248E-03    1.56       8.6  T
   7    -37.4729099 -0.136130E-07  0.951E-04    1.56      22.4  T
     SCC iter.                  ...        0 min,  0.004 sec
     gradient                   ...        0 min,  0.008 sec
 * total energy  :   -36.9885373 Eh     change       -0.2427897E-03 Eh
   gradient norm :     0.0132139 Eh/α   predicted    -0.1910561E-03 ( -21.31%)
   displ. norm   :     0.3888916 α      lambda       -0.3903017E-03
   maximum displ.:     0.2508613 α      in ANC's #1, #4, #3, ...

........................................................................
.............................. CYCLE   16 ..............................
........................................................................
   1    -37.4696921 -0.374697E+02  0.283E-01    1.58       0.0  T
   2    -37.4697075 -0.153880E-04  0.172E-01    1.60       1.0  T
   3    -37.4697014  0.607875E-05  0.285E-02    1.60       1.0  T
   4    -37.4697155 -0.140835E-04  0.121E-02    1.60       1.8  T
   5    -37.4697169 -0.133935E-05  0.651E-03    1.60       3.3  T
   6    -37.4697170 -0.157177E-06  0.180E-03    1.60      11.8  T
   7    -37.4697170 -0.110480E-07  0.797E-04    1.60      26.7  T
     SCC iter.                  ...        0 min,  0.003 sec
     gradient                   ...        0 min,  0.008 sec
 * total energy  :   -36.9887505 Eh     change       -0.2132402E-03 Eh
   gradient norm :     0.0190145 Eh/α   predicted    -0.2246671E-03 (   5.36%)
   displ. norm   :     0.2810695 α      lambda       -0.7446257E-03
   maximum displ.:     0.1704354 α      in ANC's #1, #4, #2, ...

........................................................................
.............................. CYCLE   17 ..............................
........................................................................
   1    -37.4754072 -0.374754E+02  0.198E-01    1.64       0.0  T
   2    -37.4754220 -0.148641E-04  0.120E-01    1.63       1.0  T
   3    -37.4754012  0.208174E-04  0.381E-02    1.63       1.0  T
   4    -37.4754269 -0.256482E-04  0.118E-02    1.63       1.8  T
   5    -37.4754289 -0.201799E-05  0.531E-03    1.63       4.0  T
   6    -37.4754290 -0.698482E-07  0.232E-03    1.63       9.2  T
   7    -37.4754290 -0.377985E-07  0.476E-04    1.63      44.8  T
     SCC iter.                  ...        0 min,  0.003 sec
     gradient                   ...        0 min,  0.008 sec
 * total energy  :   -36.9891730 Eh     change       -0.4224707E-03 Eh
   gradient norm :     0.0114319 Eh/α   predicted    -0.4017403E-03 (  -4.91%)
   displ. norm   :     0.5447709 α      lambda       -0.7093686E-03
   maximum displ.:     0.3517492 α      in ANC's #1, #4, #24, ...

........................................................................
.............................. CYCLE   18 ..............................
........................................................................
   1    -37.4695989 -0.374696E+02  0.421E-01    1.63       0.0  T
   2    -37.4696577 -0.588326E-04  0.257E-01    1.67       1.0  T
   3    -37.4696265  0.312332E-04  0.577E-02    1.66       1.0  T
   4    -37.4696822 -0.557064E-04  0.183E-02    1.67       1.2  T
   5    -37.4696841 -0.197329E-05  0.119E-02    1.67       1.8  T
   6    -37.4696851 -0.947843E-06  0.555E-03    1.67       3.8  T
   7    -37.4696852 -0.161366E-06  0.165E-03    1.67      12.9  T
   8    -37.4696853 -0.322132E-07  0.659E-04    1.67      32.3  T
     SCC iter.                  ...        0 min,  0.003 sec
     gradient                   ...        0 min,  0.008 sec
 * total energy  :   -36.9891818 Eh     change       -0.8814986E-05 Eh
   gradient norm :     0.0274657 Eh/α   predicted    -0.4599533E-03 (5117.86%)
   displ. norm   :     0.1266821 α      lambda       -0.9803879E-03
   maximum displ.:     0.0946174 α      in ANC's #4, #7, #8, ...

........................................................................
.............................. CYCLE   19 ..............................
........................................................................
   1    -37.4744968 -0.374745E+02  0.129E-01    1.68       0.0  T
   2    -37.4745177 -0.208501E-04  0.798E-02    1.65       1.0  T
   3    -37.4745081  0.957813E-05  0.344E-02    1.66       1.0  T
   4    -37.4745212 -0.131441E-04  0.107E-02    1.65       2.0  T
   5    -37.4745232 -0.194469E-05  0.419E-03    1.65       5.1  T
   6    -37.4745233 -0.139319E-06  0.217E-03    1.65       9.8  T
     SCC iter.                  ...        0 min,  0.003 sec
     gradient                   ...        0 min,  0.008 sec
 * total energy  :   -36.9896255 Eh     change       -0.4437532E-03 Eh
   gradient norm :     0.0097417 Eh/α   predicted    -0.4980646E-03 (  12.24%)
   displ. norm   :     0.2641620 α      lambda       -0.3302496E-03
   maximum displ.:     0.1630999 α      in ANC's #1, #2, #4, ...

........................................................................
.............................. CYCLE   20 ..............................
........................................................................
   1    -37.4723438 -0.374723E+02  0.176E-01    1.66       0.0  T
   2    -37.4723602 -0.164543E-04  0.109E-01    1.67       1.0  T
   3    -37.4723012  0.590501E-04  0.579E-02    1.67       1.0  T
   4    -37.4723690 -0.678490E-04  0.103E-02    1.67       2.1  T
   5    -37.4723701 -0.103521E-05  0.491E-03    1.67       4.3  T
   6    -37.4723702 -0.971310E-07  0.278E-03    1.67       7.7  T
   7    -37.4723702 -0.823255E-08  0.901E-04    1.67      23.7  T
     SCC iter.                  ...        0 min,  0.003 sec
     gradient                   ...        0 min,  0.008 sec
 * total energy  :   -36.9897430 Eh     change       -0.1174466E-03 Eh
   gradient norm :     0.0145573 Eh/α   predicted    -0.1766518E-03 (  50.41%)
   displ. norm   :     0.2174717 α      lambda       -0.3403597E-03
   maximum displ.:     0.1675653 α      in ANC's #1, #4, #24, ...
 * RMSD in coord.:     0.9913366 α      energy gain  -0.3232427E-01 Eh

generating ANC from model Hessian ...
Using Lindh-Hessian (1995)
 Shifting diagonal of input Hessian by   6.465118727800995E-003
 Lowest  eigenvalues of input Hessian
   -0.000000    0.000000    0.000000    0.000000    0.000000    0.000000
    0.010000    0.010428    0.016975    0.018372    0.025556    0.029546
    0.031475    0.035745    0.044281    0.049403    0.057479    0.058579
 Highest eigenvalues
    1.564474    1.647511    1.815375    1.910047    2.152425    2.237174
 

........................................................................
.............................. CYCLE   21 ..............................
........................................................................
   1    -37.4738216 -0.374738E+02  0.143E-01    1.68       0.0  T
   2    -37.4738294 -0.771387E-05  0.861E-02    1.70       1.0  T
   3    -37.4738116  0.177404E-04  0.319E-02    1.69       1.0  T
   4    -37.4738323 -0.206939E-04  0.777E-03    1.70       2.7  T
   5    -37.4738330 -0.668607E-06  0.382E-03    1.70       5.6  T
   6    -37.4738330 -0.669039E-07  0.201E-03    1.70      10.6  T
   7    -37.4738331 -0.584157E-08  0.860E-04    1.70      24.8  T
   8    -37.4738331 -0.104013E-07  0.249E-04    1.70      85.5  T
     SCC iter.                  ...        0 min,  0.003 sec
     gradient                   ...        0 min,  0.008 sec
 * total energy  :   -36.9899782 Eh     change       -0.2352506E-03 Eh
   gradient norm :     0.0064679 Eh/α   predicted     0.0000000E+00 (-100.00%)
   displ. norm   :     0.0736651 α      lambda       -0.1615543E-03
   maximum displ.:     0.0626408 α      in ANC's #1, #3, #4, ...

........................................................................
.............................. CYCLE   22 ..............................
........................................................................
   1    -37.4761514 -0.374762E+02  0.460E-02    1.70       0.0  T
   2    -37.4761519 -0.509129E-06  0.278E-02    1.70       1.0  T
   3    -37.4761517  0.163381E-06  0.469E-03    1.70       4.5  T
   4    -37.4761521 -0.343219E-06  0.168E-03    1.70      12.7  T
   5    -37.4761521 -0.366279E-08  0.108E-03    1.70      19.7  T
     SCC iter.                  ...        0 min,  0.002 sec
     gradient                   ...        0 min,  0.008 sec
 * total energy  :   -36.9900744 Eh     change       -0.9616384E-04 Eh
   gradient norm :     0.0028050 Eh/α   predicted    -0.8122236E-04 ( -15.54%)
   displ. norm   :     0.0656115 α      lambda       -0.6123362E-04
   maximum displ.:     0.0580495 α      in ANC's #1, #4, #3, ...

........................................................................
.............................. CYCLE   23 ..............................
........................................................................
   1    -37.4773063 -0.374773E+02  0.346E-02    1.70       0.0  T
   2    -37.4773066 -0.252781E-06  0.207E-02    1.70       1.0  T
   3    -37.4773061  0.459700E-06  0.531E-03    1.70       4.0  T
   4    -37.4773067 -0.549375E-06  0.154E-03    1.70      13.9  T
   5    -37.4773067 -0.275953E-07  0.791E-04    1.70      27.0  T
   6    -37.4773067 -0.250299E-08  0.269E-04    1.70      79.4  T
     SCC iter.                  ...        0 min,  0.003 sec
     gradient                   ...        0 min,  0.008 sec
 * total energy  :   -36.9901152 Eh     change       -0.4075548E-04 Eh
   gradient norm :     0.0017113 Eh/α   predicted    -0.3075048E-04 ( -24.55%)
   displ. norm   :     0.1013155 α      lambda       -0.3516868E-04
   maximum displ.:     0.0824579 α      in ANC's #1, #4, #2, ...

........................................................................
.............................. CYCLE   24 ..............................
........................................................................
   1    -37.4771445 -0.374771E+02  0.634E-02    1.70       0.0  T
   2    -37.4771453 -0.813882E-06  0.385E-02    1.70       1.0  T
   3    -37.4771433  0.199380E-05  0.111E-02    1.70       1.9  T
   4    -37.4771459 -0.251340E-05  0.273E-03    1.70       7.8  T
   5    -37.4771459 -0.428280E-07  0.161E-03    1.70      13.3  T
   6    -37.4771459 -0.924634E-08  0.493E-04    1.70      43.2  T
   7    -37.4771459 -0.105822E-08  0.160E-04    1.70     133.4  T
     SCC iter.                  ...        0 min,  0.003 sec
     gradient                   ...        0 min,  0.008 sec
 * total energy  :   -36.9901559 Eh     change       -0.4079360E-04 Eh
   gradient norm :     0.0020524 Eh/α   predicted    -0.1766835E-04 ( -56.69%)
   displ. norm   :     0.1023400 α      lambda       -0.4389189E-04
   maximum displ.:     0.0734797 α      in ANC's #1, #4, #2, ...

........................................................................
.............................. CYCLE   25 ..............................
........................................................................
   1    -37.4765840 -0.374766E+02  0.683E-02    1.71       0.0  T
   2    -37.4765848 -0.826763E-06  0.415E-02    1.71       1.0  T
   3    -37.4765842  0.599729E-06  0.809E-03    1.71       2.6  T
   4    -37.4765853 -0.114160E-05  0.281E-03    1.71       7.6  T
   5    -37.4765854 -0.411640E-07  0.168E-03    1.71      12.7  T
   6    -37.4765854 -0.131234E-07  0.503E-04    1.71      42.4  T
   7    -37.4765854 -0.165584E-08  0.199E-04    1.71     107.3  T
     SCC iter.                  ...        0 min,  0.003 sec
     gradient                   ...        0 min,  0.008 sec
 * total energy  :   -36.9901936 Eh     change       -0.3762155E-04 Eh
   gradient norm :     0.0024604 Eh/α   predicted    -0.2217735E-04 ( -41.05%)
   displ. norm   :     0.2333860 α      lambda       -0.8021791E-04
   maximum displ.:     0.1619525 α      in ANC's #1, #4, #2, ...

........................................................................
.............................. CYCLE   26 ..............................
........................................................................
   1    -37.4753186 -0.374753E+02  0.159E-01    1.73       0.0  T
   2    -37.4753233 -0.470932E-05  0.969E-02    1.74       1.0  T
   3    -37.4753220  0.132074E-05  0.165E-02    1.73       1.3  T
   4    -37.4753263 -0.428299E-05  0.666E-03    1.74       3.2  T
   5    -37.4753265 -0.253225E-06  0.399E-03    1.74       5.3  T
   6    -37.4753266 -0.841559E-07  0.115E-03    1.74      18.5  T
   7    -37.4753266 -0.105633E-07  0.383E-04    1.74      55.7  T
   8    -37.4753266 -0.173082E-08  0.177E-04    1.74     120.4  T
     SCC iter.                  ...        0 min,  0.003 sec
     gradient                   ...        0 min,  0.008 sec
 * total energy  :   -36.9902384 Eh     change       -0.4484155E-04 Eh
   gradient norm :     0.0048155 Eh/α   predicted    -0.4229397E-04 (  -5.68%)
   displ. norm   :     0.0403953 α      lambda       -0.1967393E-04
   maximum displ.:     0.0276482 α      in ANC's #4, #1, #6, ...

........................................................................
.............................. CYCLE   27 ..............................
........................................................................
   1    -37.4760187 -0.374760E+02  0.280E-02    1.75       0.0  T
   2    -37.4760190 -0.335064E-06  0.170E-02    1.75       1.3  T
   3    -37.4760188  0.230253E-06  0.429E-03    1.75       5.0  T
   4    -37.4760191 -0.302844E-06  0.169E-03    1.75      12.6  T
   5    -37.4760191 -0.438758E-07  0.734E-04    1.75      29.0  T
     SCC iter.                  ...        0 min,  0.002 sec
     gradient                   ...        0 min,  0.008 sec
 * total energy  :   -36.9902539 Eh     change       -0.1548894E-04 Eh
   gradient norm :     0.0026570 Eh/α   predicted    -0.9856003E-05 ( -36.37%)
   displ. norm   :     0.0665611 α      lambda       -0.2282601E-04
   maximum displ.:     0.0486264 α      in ANC's #4, #1, #6, ...

........................................................................
.............................. CYCLE   28 ..............................
........................................................................
   1    -37.4770434 -0.374770E+02  0.534E-02    1.76       0.0  T
   2    -37.4770443 -0.843233E-06  0.327E-02    1.76       1.0  T
   3    -37.4770438  0.456524E-06  0.681E-03    1.76       3.1  T
   4    -37.4770446 -0.821721E-06  0.270E-03    1.76       7.9  T
   5    -37.4770447 -0.787729E-07  0.146E-03    1.76      14.6  T
   6    -37.4770447 -0.612346E-08  0.590E-04    1.76      36.1  T
   7    -37.4770447 -0.230849E-08  0.216E-04    1.76      98.9  T
     SCC iter.                  ...        0 min,  0.003 sec
     gradient                   ...        0 min,  0.008 sec
 * total energy  :   -36.9902667 Eh     change       -0.1280973E-04 Eh
   gradient norm :     0.0005368 Eh/α   predicted    -0.1146751E-04 ( -10.48%)
   displ. norm   :     0.0994481 α      lambda        0.1372089E-04
   maximum displ.:     0.0729437 α      in ANC's #4, #1, #6, ...

........................................................................
.............................. CYCLE   29 ..............................
........................................................................
   1    -37.4783152 -0.374783E+02  0.799E-02    1.77       0.0  T
   2    -37.4783170 -0.171750E-05  0.490E-02    1.78       1.0  T
   3    -37.4783160  0.985628E-06  0.998E-03    1.78       2.1  T
   4    -37.4783178 -0.180598E-05  0.390E-03    1.78       5.5  T
   5    -37.4783179 -0.152419E-06  0.213E-03    1.78      10.0  T
   6    -37.4783180 -0.127191E-07  0.824E-04    1.78      25.9  T
   7    -37.4783180 -0.446924E-08  0.302E-04    1.78      70.6  T
     SCC iter.                  ...        0 min,  0.003 sec
     gradient                   ...        0 min,  0.008 sec
 * total energy  :   -36.9902516 Eh     change        0.1506653E-04 Eh
   gradient norm :     0.0034697 Eh/α   predicted     0.6889361E-05 ( -54.27%)
   displ. norm   :     0.0345735 α      lambda       -0.2253683E-04
   maximum displ.:     0.0235299 α      in ANC's #4, #1, #6, ...

........................................................................
.............................. CYCLE   30 ..............................
........................................................................
   1    -37.4774589 -0.374775E+02  0.287E-02    1.77       0.0  T
   2    -37.4774592 -0.323960E-06  0.177E-02    1.77       1.2  T
   3    -37.4774588  0.363868E-06  0.510E-03    1.77       4.2  T
   4    -37.4774593 -0.487127E-06  0.170E-03    1.77      12.6  T
   5    -37.4774594 -0.369204E-07  0.842E-04    1.77      25.3  T
   6    -37.4774594 -0.206681E-08  0.362E-04    1.77      58.9  T
     SCC iter.                  ...        0 min,  0.003 sec
     gradient                   ...        0 min,  0.008 sec
 * total energy  :   -36.9902665 Eh     change       -0.1488589E-04 Eh
   gradient norm :     0.0012136 Eh/α   predicted    -0.1128382E-04 ( -24.20%)
   displ. norm   :     0.0854027 α      lambda       -0.6001730E-05
   maximum displ.:     0.0553855 α      in ANC's #4, #1, #2, ...

........................................................................
.............................. CYCLE   31 ..............................
........................................................................
   1    -37.4767727 -0.374768E+02  0.604E-02    1.76       0.0  T
   2    -37.4767736 -0.895441E-06  0.368E-02    1.75       1.0  T
   3    -37.4767736 -0.484350E-07  0.513E-03    1.75       4.2  T
   4    -37.4767740 -0.357577E-06  0.261E-03    1.75       8.2  T
   5    -37.4767740 -0.576853E-07  0.155E-03    1.75      13.7  T
   6    -37.4767740 -0.106972E-07  0.579E-04    1.75      36.8  T
   7    -37.4767740 -0.264396E-08  0.188E-04    1.75     113.2  T
     SCC iter.                  ...        0 min,  0.003 sec
     gradient                   ...        0 min,  0.008 sec
 * total energy  :   -36.9902676 Eh     change       -0.1100707E-05 Eh
   gradient norm :     0.0007030 Eh/α   predicted    -0.3020788E-05 ( 174.44%)
   displ. norm   :     0.0490731 α      lambda       -0.2591890E-05
   maximum displ.:     0.0337839 α      in ANC's #4, #1, #6, ...

   *** GEOMETRY OPTIMIZATION CONVERGED AFTER 31 ITERATIONS ***

------------------------------------------------------------------------
 total energy gain   :        -0.0328489 Eh      -20.6130 kcal/mol
 total RMSD          :         1.0780451 a0        0.5705 Å
 total power (kW/mol):        -2.7820904 (step) -160.1494 (real)
------------------------------------------------------------------------

 ANCopt (total)                0 d,  0 h,  0 min,  0.539 sec
 optimizer setup                ...        0 min,  0.000 sec (  0.014%)
 model hessian                  ...        0 min,  0.018 sec (  3.410%)
 ANC generation                 ...        0 min,  0.001 sec (  0.121%)
 coordinate transformation      ...        0 min,  0.000 sec (  0.039%)
 single point calculation       ...        0 min,  0.511 sec ( 94.948%)
 optimization log               ...        0 min,  0.002 sec (  0.319%)
 hessian update                 ...        0 min,  0.000 sec (  0.033%)
 rational function              ...        0 min,  0.005 sec (  0.949%)

================
 final structure:
================
22
 xtb: 6.2.3 (830e466)
O         0.98304903325486    2.33985126217165   -1.66589058392014
C         0.93061487857139    1.40941896867469   -0.89159601081036
C         1.60478651502555    1.45399807887905    0.41913100562907
C         1.85252996380396    0.36252591598283    1.14519445351325
C         0.14210220230422    0.16880616640296   -1.19859177394805
C        -1.39970265183307    0.41088964640117   -0.88913910889967
N        -1.91553015551990   -0.93574456669420   -0.75709537071387
C        -1.00424673584662   -1.35022459915484    0.28893479854738
C        -1.21226846255605   -0.23136552478599    1.27355694028289
C        -1.45612981894356    0.85274971116062    0.54827257310385
C         0.42297647924572   -1.08371040718070   -0.36275788483353
C         1.47237444792863   -0.99353318229893    0.70796723499550
O         1.95574983451625   -1.98435215756804    1.21115502055512
H         1.94017657099469    2.43300413381168    0.73536420540611
H         2.39864200416704    0.41357669720556    2.07774153634171
H         0.23314147338925   -0.03476849545432   -2.26930467822187
H        -1.90245621510148    1.03284722285584   -1.62310318670545
H        -1.83624827356458   -1.48628553176892   -1.60657860825989
H        -1.13878069362738   -2.36506320681310    0.64988564609547
H        -1.11789664246311   -0.33385098617509    2.33693670084626
H        -1.61187197698967    1.86523603107040    0.86583292914764
H         0.65888822324392   -1.94400517672247   -0.99571583815149
 
 Bond Distances (Angstroems)
 ---------------------------
O1-C2=1.2116         C2-O1=1.2116         C2-C3=1.4746         C2-C5=1.5017         C3-C2=1.4746         C3-C4=1.3341         
C3-H14=1.0821        C4-C3=1.3341         C4-C12=1.4746        C4-H15=1.0819        C5-C2=1.5017         C5-C6=1.5911         
C5-C11=1.5318        C5-H16=1.0937        C6-C5=1.5911         C6-N7=1.4481         C6-C10=1.5049        C6-H17=1.0855        
N7-C6=1.4481         N7-C8=1.4479         N7-H18=1.0154        C8-N7=1.4479         C8-C9=1.5049         C8-C11=1.5914        
C8-H19=1.0855        C9-C8=1.5049         C9-C10=1.3270        C9-H20=1.0725        C10-C6=1.5049        C10-C9=1.3270        
C10-H21=1.0725       C11-C5=1.5318        C11-C8=1.5914        C11-C12=1.5019       C11-H22=1.0938       C12-C4=1.4746        
C12-C11=1.5019       C12-O13=1.2118       O13-C12=1.2118       H14-C3=1.0821        H15-C4=1.0819        H16-C5=1.0937        
H17-C6=1.0855        H18-N7=1.0154        H19-C8=1.0855        H20-C9=1.0725        H21-C10=1.0725       H22-C11=1.0938       
 C  H  Rav=1.0834 sigma=0.0076  Rmin=1.0725  Rmax=1.0938     8
 C  C  Rav=1.4853 sigma=0.0821  Rmin=1.3270  Rmax=1.5914    11
 N  H  Rav=1.0154 sigma=0.0000  Rmin=1.0154  Rmax=1.0154     1
 N  C  Rav=1.4480 sigma=0.0001  Rmin=1.4479  Rmax=1.4481     2
 O  C  Rav=1.2117 sigma=0.0001  Rmin=1.2116  Rmax=1.2118     2
 
 selected bond angles (degree)
 --------------------
C3-C2-O1=121.67                C5-C2-O1=121.77                C5-C2-C3=116.53                C4-C3-C2=122.95                
H14-C3-C2=115.39               H14-C3-C4=121.57               C12-C4-C3=122.89               H15-C4-C3=121.62               
H15-C4-C12=115.41              C6-C5-C2=110.08                C11-C5-C2=117.88               C11-C5-C6=101.30               
H16-C5-C2=108.07               H16-C5-C6=107.42               H16-C5-C11=111.51              N7-C6-C5=102.79                
C10-C6-C5=105.47               C10-C6-N7= 99.94               H17-C6-C5=113.86               H17-C6-N7=115.44               
H17-C6-C10=117.40              C8-N7-C6= 96.19                H18-N7-C6=113.59               H18-N7-C8=113.58               
C9-C8-N7= 99.95                C11-C8-N7=102.75               C11-C8-C9=105.51               H19-C8-N7=115.46               
H19-C8-C9=117.41               H19-C8-C11=113.82              C10-C9-C8=105.97               H20-C9-C8=124.44               
H20-C9-C10=129.51              C9-C10-C6=105.98               H21-C10-C6=124.43              H21-C10-C9=129.50              
 
 selected dihedral angles (degree)
 ---------------------------------
C4-C3-C2-O1=197.14            C4-C3-C2-C5= 18.94            H14-C3-C2-O1= 13.83           H14-C3-C2-C5=195.63           
C12-C4-C3-C2=359.83           C12-C4-C3-H14=183.34          H15-C4-C3-C2=176.46           H15-C4-C3-H14=359.96          
C6-C5-C2-O1=279.47            C6-C5-C2-C3= 97.67            C11-C5-C2-O1=164.03           C11-C5-C2-C3=342.23           
H16-C5-C2-O1= 36.51           H16-C5-C2-C3=214.71           N7-C6-C5-C2=200.00            N7-C6-C5-C11=325.52           
N7-C6-C5-H16= 82.56           C10-C6-C5-C2=304.28           C10-C6-C5-C11= 69.79          C10-C6-C5-H16=186.83          
H17-C6-C5-C2= 74.41           H17-C6-C5-C11=199.92          H17-C6-C5-H16=316.97          C8-N7-C6-C5= 56.38            
C8-N7-C6-C10=307.86           C8-N7-C6-H17=180.94           H18-N7-C6-C5=297.27           H18-N7-C6-C10=188.75          
H18-N7-C6-H17= 61.83          C9-C8-N7-C6= 52.13            C9-C8-N7-H18=171.24           C11-C8-N7-C6=303.58           
C11-C8-N7-H18= 62.69          H19-C8-N7-C6=179.09           H19-C8-N7-H18=298.20          C10-C9-C8-N7=326.76           
C10-C9-C8-C11= 73.09          C10-C9-C8-H19=201.12          H20-C9-C8-N7=149.70           H20-C9-C8-C11=256.03          
H20-C9-C8-H19= 24.06          C9-C10-C6-C5=286.91           C9-C10-C6-N7= 33.28           C9-C10-C6-H17=158.87          
H21-C10-C6-C5=103.91          H21-C10-C6-N7=210.28          H21-C10-C6-H17=335.87         C6-C10-C9-C8=359.97           
C6-C10-C9-H20=176.84          H21-C10-C9-C8=183.18          H21-C10-C9-H20=  0.05         
           -------------------------------------------------
          |                Final Singlepoint                |
           -------------------------------------------------

          ...................................................
          :                      SETUP                      :
          :.................................................:
          :  # basis functions                  61          :
          :  # atomic orbitals                  61          :
          :  # shells                           35          :
          :  # electrons                        66          :
          :  max. iterations                   250          :
          :  Hamiltonian                  GFN2-xTB          :
          :  restarted?                      false          :
          :  GBSA solvation                  false          :
          :  PC potential                    false          :
          :  electronic temp.          300.0000000     K    :
          :  accuracy                    1.0000000          :
          :  -> integral cutoff          0.2500000E+02      :
          :  -> integral neglect         0.1000000E-07      :
          :  -> SCF convergence          0.1000000E-05 Eh   :
          :  -> wf. convergence          0.1000000E-03 e    :
          :  Broyden damping             0.4000000          :
          ...................................................

 iter      E             dE          RMSdq      gap      omega  full diag
   1    -37.4767740 -0.374768E+02  0.107E-04    1.75       0.0  T
   2    -37.4767740 -0.901679E-11  0.463E-05    1.75     460.7  T
   3    -37.4767740 -0.213660E-10  0.534E-05    1.75     398.9  T

   *** convergence criteria satisfied after 3 iterations ***

         #    Occupation            Energy/Eh            Energy/eV
      -------------------------------------------------------------
         1        2.0000           -0.7277940             -19.8043
       ...           ...                  ...                  ...
        27        2.0000           -0.4726248             -12.8608
        28        2.0000           -0.4615707             -12.5600
        29        2.0000           -0.4520149             -12.3000
        30        2.0000           -0.4260996             -11.5948
        31        2.0000           -0.4224324             -11.4950
        32        2.0000           -0.4054782             -11.0336
        33        2.0000           -0.3945978             -10.7376 (HOMO)
        34                         -0.3301169              -8.9829 (LUMO)
        35                         -0.2517783              -6.8512
        36                         -0.2347594              -6.3881
        37                         -0.1846636              -5.0250
        38                         -0.0172258              -0.4687
       ...                                ...                  ...
        61                          0.6944269              18.8963
      -------------------------------------------------------------
                  HL-Gap            0.0644808 Eh            1.7546 eV
             Fermi-level           -0.3623573 Eh           -9.8602 eV

 SCC (total)                   0 d,  0 h,  0 min,  0.015 sec
 SCC setup                      ...        0 min,  0.000 sec (  0.626%)
 Dispersion                     ...        0 min,  0.000 sec (  0.323%)
 integral evaluation            ...        0 min,  0.005 sec ( 34.432%)
 zeroth order Hamiltonian       ...        0 min,  0.000 sec (  0.548%)
 iterations                     ...        0 min,  0.001 sec (  8.814%)
 molecular gradient             ...        0 min,  0.008 sec ( 54.686%)
 printout                       ...        0 min,  0.000 sec (  0.435%)

         :::::::::::::::::::::::::::::::::::::::::::::::::::::
         ::                     SUMMARY                     ::
         :::::::::::::::::::::::::::::::::::::::::::::::::::::
         :: total energy             -36.990267613593 Eh    ::
         :: gradient norm              0.000703952302 Eh/a0 ::
         :: HOMO-LUMO gap              1.754612835799 eV    ::
         ::.................................................::
         :: SCC energy               -37.476774043814 Eh    ::
         :: -> isotropic ES            0.056019183542 Eh    ::
         :: -> anisotropic ES          0.003043828927 Eh    ::
         :: -> anisotropic XC          0.017012857988 Eh    ::
         :: -> dispersion             -0.023891861871 Eh    ::
         :: repulsion energy           0.486321451848 Eh    ::
         :: add. restraining           0.000000000000 Eh    ::
         :::::::::::::::::::::::::::::::::::::::::::::::::::::

           -------------------------------------------------
          |                Property Printout                |
           -------------------------------------------------

    * Orbital Energies and Occupations

         #    Occupation            Energy/Eh            Energy/eV
      -------------------------------------------------------------
         1        2.0000           -0.7277940             -19.8043
       ...           ...                  ...                  ...
        21        2.0000           -0.5144364             -13.9985
        22        2.0000           -0.5076716             -13.8144
        23        2.0000           -0.4998819             -13.6025
        24        2.0000           -0.4969751             -13.5234
        25        2.0000           -0.4869643             -13.2510
        26        2.0000           -0.4815569             -13.1038
        27        2.0000           -0.4726248             -12.8608
        28        2.0000           -0.4615707             -12.5600
        29        2.0000           -0.4520149             -12.3000
        30        2.0000           -0.4260996             -11.5948
        31        2.0000           -0.4224324             -11.4950
        32        2.0000           -0.4054782             -11.0336
        33        2.0000           -0.3945978             -10.7376 (HOMO)
        34                         -0.3301169              -8.9829 (LUMO)
        35                         -0.2517783              -6.8512
        36                         -0.2347594              -6.3881
        37                         -0.1846636              -5.0250
        38                         -0.0172258              -0.4687
        39                          0.0381606               1.0384
        40                          0.0386767               1.0524
        41                          0.0493089               1.3418
        42                          0.0564504               1.5361
        43                          0.0760432               2.0692
        44                          0.0812367               2.2106
       ...                                ...                  ...
        61                          0.6944269              18.8963
      -------------------------------------------------------------
                  HL-Gap            0.0644808 Eh            1.7546 eV
             Fermi-level           -0.3623573 Eh           -9.8602 eV

     #   Z        covCN         q      C6AA      α(0)
     1   8 O      0.858    -0.351    20.735     6.105
     2   6 C      2.820     0.235    23.089     7.873
     3   6 C      2.895    -0.038    28.954     8.822
     4   6 C      2.894    -0.038    28.955     8.822
     5   6 C      3.874    -0.052    21.460     6.587
     6   6 C      4.071     0.056    19.553     6.281
     7   7 N      2.771    -0.238    26.213     7.604
     8   6 C      4.071     0.056    19.553     6.281
     9   6 C      3.009    -0.039    28.948     8.826
    10   6 C      3.009    -0.039    28.947     8.826
    11   6 C      3.874    -0.052    21.461     6.587
    12   6 C      2.820     0.235    23.092     7.874
    13   8 O      0.858    -0.352    20.738     6.106
    14   1 H      0.925     0.078     1.996     2.209
    15   1 H      0.925     0.078     1.995     2.209
    16   1 H      0.924     0.061     2.185     2.311
    17   1 H      0.925     0.051     2.304     2.373
    18   1 H      0.860     0.143     1.447     1.884
    19   1 H      0.925     0.051     2.304     2.374
    20   1 H      0.926     0.046     2.368     2.407
    21   1 H      0.926     0.046     2.368     2.406
    22   1 H      0.924     0.061     2.185     2.311

 Mol. C6AA /au·bohr⁶  :       5835.149565
 Mol. C8AA /au·bohr⁸  :     140240.487013
 Mol. α(0) /au        :        117.078741


Wiberg/Mayer (AO) data.
largest (>0.10) Wiberg bond orders for each atom
          total WBO             WBO to atom ...
     1  O   2.071        C    2 1.811
     2  C   3.934        O    1 1.811    C    3 1.037    C    5 0.994
     3  C   3.983        C    4 1.818    C    2 1.037    H   14 0.959
     4  C   3.983        C    3 1.818    C   12 1.037    H   15 0.959
     5  C   3.993        C   11 1.000    C    2 0.994    H   16 0.954    C    6 0.882
     6  C   3.978        N    7 1.014    C   10 1.013    H   17 0.969    C    5 0.882
     7  N   3.122        C    8 1.014    C    6 1.014    H   18 0.953
     8  C   3.978        N    7 1.014    C    9 1.013    H   19 0.969    C   11 0.881
     9  C   3.986        C   10 1.916    C    8 1.013    H   20 0.970
    10  C   3.986        C    9 1.916    C    6 1.013    H   21 0.970
    11  C   3.993        C    5 1.000    C   12 0.994    H   22 0.954    C    8 0.881
    12  C   3.934        O   13 1.811    C    4 1.037    C   11 0.994
    13  O   2.071        C   12 1.811
    14  H   0.994        C    3 0.959
    15  H   0.994        C    4 0.959
    16  H   0.996        C    5 0.954
    17  H   0.997        C    6 0.969
    18  H   0.979        N    7 0.953
    19  H   0.997        C    8 0.969
    20  H   0.998        C    9 0.970
    21  H   0.998        C   10 0.970
    22  H   0.996        C   11 0.954

molecular dipole:
                 x           y           z       tot (Debye)
 q only:       -0.677      -0.023       0.191
   full:       -0.392      -0.061       0.039       1.013
molecular quadrupole (traceless):
                xx          xy          yy          xz          yz          zz
 q only:        0.947       4.064      -4.320       1.554      10.899       3.373
  q+dip:       -3.507       4.126      -3.136       2.863      13.940       6.643
   full:       -1.127       3.946      -4.790       1.157      14.310       5.917

           -------------------------------------------------
          |                Geometry Summary                 |
           -------------------------------------------------

      molecular mass/u    :      175.1843388
   center of mass at/Å    :        0.1943351       0.0237683      -0.0297096
  moments of inertia/u·Å² :        0.4572103E+03   0.4629822E+03   0.7074681E+03
rotational constants/cm⁻¹ :        0.3687063E-01   0.3641097E-01   0.2382812E-01

 * 18 selected distances

     #   Z        #   Z                                     value/Å
     1   8 O      2   6 C                                 1.2116046
     3   6 C      4   6 C                                 1.3341126
     6   6 C      7   7 N                                 1.4480805
     7   7 N      8   6 C                                 1.4478986
     8   6 C      9   6 C                                 1.5048586
     6   6 C     10   6 C                                 1.5048511
     9   6 C     10   6 C                                 1.3269558
     5   6 C     11   6 C                                 1.5317658 (max)
    12   6 C     13   8 O                                 1.2118465
     3   6 C     14   1 H                                 1.0821011
     4   6 C     15   1 H                                 1.0818912
     5   6 C     16   1 H                                 1.0936896
     6   6 C     17   1 H                                 1.0854933
     7   7 N     18   1 H                                 1.0153831 (min)
     8   6 C     19   1 H                                 1.0854871
     9   6 C     20   1 H                                 1.0724672
    10   6 C     21   1 H                                 1.0724872
    11   6 C     22   1 H                                 1.0937994

 * 5 distinct bonds (by element types)

   Z      Z             #   av. dist./Å        max./Å        min./Å
   1 H    6 C           8     1.0834270     1.0937994     1.0724672
   6 C    6 C           5     1.4405088     1.5317658     1.3269558
   1 H    7 N           1     1.0153831     1.0153831     1.0153831
   6 C    7 N           2     1.4479896     1.4480805     1.4478986
   6 C    8 O           2     1.2117255     1.2118465     1.2116046


optimized geometry written to: xtbopt.xyz


           -------------------------------------------------
          | TOTAL ENERGY              -36.990267613593 Eh   |
          | GRADIENT NORM               0.000703952302 Eh/α |
          | HOMO-LUMO GAP               1.754612835799 eV   |
           -------------------------------------------------

------------------------------------------------------------------------
 * finished run on 2020/04/06 at 00:21:25.612     
------------------------------------------------------------------------
 total:
 * wall-time:     0 d,  0 h,  0 min,  0.604 sec
 *  cpu-time:     0 d,  0 h,  0 min,  0.585 sec
 * ratio c/w:     0.969 speedup
 SCF:
 * wall-time:     0 d,  0 h,  0 min,  0.021 sec
 *  cpu-time:     0 d,  0 h,  0 min,  0.021 sec
 * ratio c/w:     0.988 speedup
 ANC optimizer:
 * wall-time:     0 d,  0 h,  0 min,  0.554 sec
 *  cpu-time:     0 d,  0 h,  0 min,  0.552 sec
 * ratio c/w:     0.996 speedup

